sha,filename,url,lines,title,comment,priority,category,additional,id,private
"","/maze_generator.py","","8:4-9:64","","The function does not validate the provided w and h arguments beyond the recommendation in the docstring that at least one dimension should be greater than 2. Adding explicit checks and raising a ValueError for invalid dimensions would make the program more robust.","0","","","16f7c6ff-3b33-40d1-adb2-e1c1d7648c93","0"
"","/maze_generator.py","","66:4-66:36","","The recursive implementation for the walk function is clear and concise. However, the maximum recursion depth might be a limitation for very large mazes.","0","","","56279458-88df-4103-bc17-4e52495a9c59","0"
"","/maze_generator.py","","33:4-33:61","","The grid is padded with an extra row and column of walls that are not needed for internal representation. Considering they remain constant, they can be factored out into the string conversion at the end to reduce complexity.","0","","","a7dd8312-20fa-4745-a2e6-487a5cf5c11d","0"
"","/maze_generator.py","","72:4-75:12","","In the final string construction, there's a mix of list concatenation and tuple unpacking which might confuse readers.\n\nThe final string is built up through concatenation inside a loop. For larger mazes, it may be more efficient to use ''.join(sequence) or a StringIO object, as string concatenation in Python creates new strings every time due to string immutability.","0","","","f0bc8fd7-2909-4576-8df8-1a73b24ce173","0"
"","/maze_generator.py","","4:4-4:13","","While the program is quite concise and readable for someone familiar with Python, it might benefit from some additional inline comments, especially when manipulating row and column indices which can be a common source of errors.\nOverall, the program is well-written for the intended scope. It is clear, functional, and demonstrates good Python coding practices with areas identified for further enhancements and robustness.\n\nThe randomized depth-first search is an appropriate algorithm for maze generation and usually provides a good balance between performance and a random layout.\n\nThe code could benefit from replacing magic numbers like +1, -1, etc., with named constants to clarify their purpose.\nThere are no global variables used, which is a good practice as it avoids potential side effects and makes the code more modular.\nThe program does not include any try-except blocks since it seems there are no anticipated exceptions during normal operation.\n\nThe function includes detailed docstrings that describe its behavior, parameters, return type, and usage. The inner function walk also has a docstring, which is good practice.\nThe function names make_maze and walk are appropriate and descriptive of their functionality.\nShort variable names w, h, vis, ver, hor, d, xx, yy, s are used. While they make sense in the context of this short program, in a larger codebase, more descriptive names could be beneficial.\nThere are no type annotations. While they are not strictly needed, adding type hints could improve code readability and assist with type checking.","0","","","f207cc14-8f3b-4fb7-ab9a-a490a890791d","0"
